<?xml version="1.0" encoding="UTF-8"?>
<Toolkit xmlns:tk="http://www.qdocuments.net" xmlns:xsi="http://www.w3.org/2001/XMLSchema-instance" xsi:noNamespaceSchemaLocation="..\..\..\schema\v4\Theme.xsd">
	<Theme RegName="Metro">
		<ResourceDictionary>../Normal/Theme.xaml</ResourceDictionary>
		<ResourceDictionary>Brushes.xaml</ResourceDictionary>
		<ResourceDictionary>Fonts.xaml</ResourceDictionary>
		<ResourceDictionary>CoreStyles.xaml</ResourceDictionary>
		<ResourceDictionary>SDKStyles.xaml</ResourceDictionary>
		<ResourceDictionary>Styles.xaml</ResourceDictionary>
	</Theme>
</Toolkit>
